{
  "id": "att_01HXYZ4P9V",
  "event_id": "evt_3NqA8c2eZvKYlo2C",
  "endpoint_id": "we_1NqA8c2eZvKYlo2C",
  "attempt_number": 3,
  "status": "failed",
  "request": {
    "method": "POST",
    "url": "https://api.example.com/webhooks/stripe",
    "headers": {
      "Content-Type": "application/json",
      "Stripe-Signature": "t=1716131045,v1=5257a8...e3f9",
      "User-Agent": "Stripe/1.0 (+https://stripe.com/docs/webhooks)"
    },
    "body_size_bytes": 4823
  },
  "response": {
    "status_code": 503,
    "headers": {
      "Content-Type": "text/plain",
      "Retry-After": "120"
    },
    "body_excerpt": "Service Unavailable",
    "latency_ms": 312
  },
  "error": {
    "code": "non_2xx_response",
    "message": "Endpoint returned 503 after 312ms"
  },
  "next_retry_at": "2026-05-19T15:09:05Z",
  "attempted_at": "2026-05-19T15:04:05Z"
}
